{
  "$schema": "http://json-schema.org/draft-07/schema#",
  "$id": "https://cross-skills/schema/uir.schema.json",
  "title": "Universal Intermediate Representation",
  "description": "Ecosystem-agnostic capture of a repo's AI assistant requirements. All ecosystem generators read from this; all parsers write to it.",
  "type": "object",
  "required": ["meta", "context", "rules"],

  "definitions": {
    "techItem": {
      "type": "object",
      "required": ["name"],
      "properties": {
        "name":    { "type": "string", "description": "Technology name, e.g. 'TypeScript', 'React', 'pytest'" },
        "version": { "type": ["string", "null"], "description": "Pinned or range version, e.g. '5.x', '^18'" },
        "role":    { "type": "string", "description": "e.g. 'runtime', 'framework', 'test-runner', 'linter', 'bundler', 'database'" }
      },
      "additionalProperties": false
    },

    "rule": {
      "type": "object",
      "required": ["id", "scope", "priority", "content"],
      "properties": {
        "id": {
          "type": "string",
          "pattern": "^[a-z0-9][a-z0-9-]*$",
          "description": "Unique slug, e.g. 'no-console-log', 'prefer-async-await', 'test-files-colocated'"
        },
        "scope": {
          "type": "string",
          "enum": ["global", "file-glob", "directory", "language", "task-type"],
          "description": "When this rule applies. 'global' = always; 'file-glob' = only on matched files; 'directory' = scoped to a path prefix; 'language' = scoped to a language; 'task-type' = scoped to a class of AI task"
        },
        "scope_value": {
          "type": ["string", "null"],
          "description": "For 'file-glob': '**/*.test.ts'. For 'directory': 'src/api/'. For 'language': 'typescript'. For 'task-type': 'commit-message' | 'code-review' | 'refactor' | 'documentation'. Null for 'global'."
        },
        "priority": {
          "type": "integer",
          "minimum": 1,
          "maximum": 10,
          "description": "1 = critical (always enforce, alwaysApply in Cursor). 5 = standard convention. 10 = suggestion. Used to drive alwaysApply vs manual activation in Cursor."
        },
        "category": {
          "type": "string",
          "enum": ["code-style", "architecture", "testing", "security", "documentation", "git", "tooling", "agent-behavior", "domain"],
          "description": "Semantic category for grouping and filtering during generation"
        },
        "content": {
          "type": "string",
          "minLength": 1,
          "description": "The rule text in plain English. Single responsibility. Written as an instruction to the AI."
        },
        "rationale": {
          "type": ["string", "null"],
          "description": "Why this rule exists. Included in rich-format ecosystems (Claude Code, Cursor). Omitted in flat-text ecosystems."
        },
        "examples": {
          "type": ["object", "null"],
          "properties": {
            "good": { "type": ["string", "null"] },
            "bad":  { "type": ["string", "null"] }
          },
          "additionalProperties": false,
          "description": "Optional code examples illustrating the rule"
        },
        "tags": {
          "type": "array",
          "items": { "type": "string" },
          "description": "Free-form tags for filtering and cross-referencing"
        },
        "_degraded": {
          "type": ["boolean", "null"],
          "description": "Set to true during translation when this rule lost fidelity from source ecosystem"
        },
        "_degraded_reason": {
          "type": ["string", "null"],
          "description": "Human-readable explanation of what was lost during translation"
        }
      },
      "additionalProperties": false
    },

    "skill": {
      "type": "object",
      "required": ["id", "name", "description", "instructions"],
      "properties": {
        "id":           { "type": "string", "pattern": "^[a-z0-9][a-z0-9-]*$" },
        "name":         { "type": "string" },
        "description":  { "type": "string", "description": "Activation trigger text for Claude Code. Used as section header in other ecosystems." },
        "instructions": { "type": "string", "description": "Full markdown instruction body for the skill" },
        "scope":        { "type": ["string", "null"], "description": "File glob this skill primarily applies to, if any" },
        "tags":         { "type": "array", "items": { "type": "string" } }
      },
      "additionalProperties": false
    },

    "agent": {
      "type": "object",
      "required": ["id", "name", "instructions"],
      "properties": {
        "id":            { "type": "string", "pattern": "^[a-z0-9][a-z0-9-]*$" },
        "name":          { "type": "string" },
        "role":          { "type": "string", "description": "e.g. 'code-reviewer', 'test-writer', 'architect', 'devops-specialist'" },
        "instructions":  { "type": "string" },
        "tools_allowed": { "type": "array", "items": { "type": "string" }, "description": "Tool names or patterns this agent is allowed to use" },
        "scope":         { "type": ["string", "null"], "description": "Directory or glob this agent is responsible for" }
      },
      "additionalProperties": false
    },

    "hook": {
      "type": "object",
      "required": ["event", "command"],
      "properties": {
        "event": {
          "type": "string",
          "enum": ["PreToolUse", "PostToolUse", "UserPromptSubmit", "Notification", "Stop"],
          "description": "Claude Code lifecycle event"
        },
        "matcher": {
          "type": ["string", "null"],
          "description": "Tool name or glob pattern to match for PreToolUse/PostToolUse. Null to match all."
        },
        "command": {
          "type": "string",
          "description": "Shell command to execute when this hook fires"
        },
        "description": {
          "type": ["string", "null"],
          "description": "Human-readable explanation of what this hook does"
        }
      },
      "additionalProperties": false
    }
  },

  "properties": {

    "meta": {
      "type": "object",
      "required": ["id", "name", "version", "generated_at", "source"],
      "description": "Identity and provenance of this UIR document",
      "properties": {
        "id": {
          "type": "string",
          "format": "uuid",
          "description": "UUID v4 for this UIR instance. Stable identifier for caching and change detection."
        },
        "name": {
          "type": "string",
          "description": "Human-readable project name, e.g. 'my-saas-app'"
        },
        "version": {
          "type": "string",
          "pattern": "^\\d+\\.\\d+\\.\\d+$",
          "description": "Semver of this UIR document (not the project). Increment minor on field additions, major on breaking schema changes."
        },
        "generated_at": {
          "type": "string",
          "format": "date-time",
          "description": "ISO 8601 timestamp of when this UIR was produced"
        },
        "source": {
          "type": "object",
          "required": ["method"],
          "properties": {
            "method": {
              "type": "string",
              "enum": ["analyze", "manual", "translate"],
              "description": "'analyze' = auto-generated from repo scan; 'manual' = hand-written; 'translate' = converted from another ecosystem"
            },
            "from_ecosystem": {
              "type": ["string", "null"],
              "enum": ["claude-code", "cursor", "codex", "aider", "windsurf", "roo-code", "continue", "cline", "openhand", "gemini-cli", null],
              "description": "Source ecosystem when method is 'translate'"
            },
            "repo_path": {
              "type": ["string", "null"],
              "description": "Absolute or relative path to the analyzed repo when method is 'analyze'"
            }
          },
          "additionalProperties": false
        }
      },
      "additionalProperties": false
    },

    "context": {
      "type": "object",
      "description": "What the AI should know about the project at all times. Maps to CLAUDE.md header, Cursor index.mdc, Codex AGENTS.md header, Aider CONVENTIONS.md.",
      "properties": {
        "project_summary": {
          "type": "string",
          "description": "1–3 paragraph description of the project: what it does, who it's for, and its tech stack. Rendered at the top of all config files."
        },
        "tech_stack": {
          "type": "array",
          "items": { "$ref": "#/definitions/techItem" },
          "description": "Ordered list of technologies (most important first)"
        },
        "directory_layout": {
          "type": "object",
          "additionalProperties": { "type": "string" },
          "description": "Key directories mapped to their purpose. E.g. { 'src/': 'Application source', 'tests/': 'Test suite', 'infra/': 'IaC definitions' }"
        },
        "entry_points": {
          "type": "array",
          "items": { "type": "string" },
          "description": "Main files, commands, or scripts to understand the project. E.g. ['src/index.ts', 'docker-compose.yml']"
        },
        "build_commands": {
          "type": "object",
          "properties": {
            "install": { "type": ["string", "null"] },
            "build":   { "type": ["string", "null"] },
            "test":    { "type": ["string", "null"] },
            "lint":    { "type": ["string", "null"] },
            "format":  { "type": ["string", "null"] },
            "dev":     { "type": ["string", "null"] },
            "deploy":  { "type": ["string", "null"] }
          },
          "additionalProperties": false
        },
        "environment_variables": {
          "type": "array",
          "items": {
            "type": "object",
            "required": ["name"],
            "properties": {
              "name":        { "type": "string" },
              "required":    { "type": "boolean", "default": true },
              "description": { "type": "string" },
              "example":     { "type": ["string", "null"] }
            },
            "additionalProperties": false
          }
        },
        "monorepo": {
          "type": ["object", "null"],
          "description": "Present when this is a monorepo. Null for single-package repos.",
          "properties": {
            "tool":      { "type": "string", "enum": ["turborepo", "nx", "lerna", "pnpm-workspaces", "yarn-workspaces", "cargo-workspace", "other"] },
            "packages":  { "type": "array", "items": { "type": "string" }, "description": "Package/app paths relative to repo root" }
          },
          "additionalProperties": false
        }
      },
      "additionalProperties": false
    },

    "rules": {
      "type": "array",
      "description": "Core behavioral rules for AI assistants. Unique by id. All ecosystem generators consume this array.",
      "items": { "$ref": "#/definitions/rule" }
    },

    "permissions": {
      "type": "object",
      "description": "What the AI agent is allowed or forbidden to do. Native to Claude Code settings.json. Degrades to rule text in other ecosystems.",
      "properties": {
        "allow": {
          "type": "array",
          "items": { "type": "string" },
          "description": "Tool/action patterns the agent may execute without confirmation. E.g. 'Bash(git *)', 'Read', 'Write(**/*.ts)'"
        },
        "deny": {
          "type": "array",
          "items": { "type": "string" },
          "description": "Patterns explicitly forbidden. E.g. 'Bash(rm -rf *)', 'Bash(curl * | bash *)'"
        },
        "ask_on": {
          "type": "array",
          "items": { "type": "string" },
          "description": "Patterns that require user confirmation. Claude Code-native. Degrades to 'always ask before X' rule text in other ecosystems."
        }
      },
      "additionalProperties": false
    },

    "memory": {
      "type": "object",
      "description": "Persistent context the AI should maintain across sessions",
      "properties": {
        "always_load": {
          "type": "array",
          "items": { "type": "string" },
          "description": "File paths (relative to repo root) to always include in AI context. Maps to CLAUDE.md @imports, Cursor alwaysApply rules, Aider --read."
        },
        "on_demand": {
          "type": "array",
          "items": { "type": "string" },
          "description": "File paths to load when topically relevant. Maps to Cursor manual-activation rules, Aider /add."
        },
        "ignore": {
          "type": "array",
          "items": { "type": "string" },
          "description": "Glob patterns to exclude from AI context. Merged into ignore_patterns during generation."
        }
      },
      "additionalProperties": false
    },

    "hooks": {
      "type": "array",
      "description": "Lifecycle hooks — shell commands triggered by agent events. Native to Claude Code. Degrades to rule text in Cursor, dropped in Codex/Aider.",
      "items": { "$ref": "#/definitions/hook" }
    },

    "skills": {
      "type": "array",
      "description": "Reusable task skill definitions. Claude Code-native via Skill tool. Translated to Cursor manual-activation .mdc rules or Aider CONVENTIONS.md sections.",
      "items": { "$ref": "#/definitions/skill" }
    },

    "agents": {
      "type": "array",
      "description": "Sub-agent definitions. Maps to AGENTS.md for both Claude Code and OpenAI Codex CLI. Flattened to context section in Cursor and Aider.",
      "items": { "$ref": "#/definitions/agent" }
    },

    "ignore_patterns": {
      "type": "array",
      "items": { "type": "string" },
      "description": "Unified ignore list in gitignore syntax. Rendered to .aiderignore, .cursorignore, and respected by Claude Code."
    },

    "extensions": {
      "type": "object",
      "description": "Ecosystem-specific data that cannot be represented in UIR core fields. Keyed by ecosystem id. Generators merge these into output but validators flag unknown keys.",
      "properties": {
        "claude-code": { "type": "object", "additionalProperties": true },
        "cursor":      { "type": "object", "additionalProperties": true },
        "codex":       { "type": "object", "additionalProperties": true },
        "aider":       { "type": "object", "additionalProperties": true },
        "windsurf":    { "type": "object", "additionalProperties": true },
        "roo-code":    { "type": "object", "additionalProperties": true },
        "continue":    { "type": "object", "additionalProperties": true },
        "cline":       { "type": "object", "additionalProperties": true },
        "openhand":    { "type": "object", "additionalProperties": true },
        "gemini-cli":  { "type": "object", "additionalProperties": true }
      },
      "additionalProperties": false
    }
  },

  "additionalProperties": false
}
