{
  "meta": {
    "id": "b2c3d4e5-f6a7-8901-bcde-f12345678901",
    "name": "space-explorer",
    "version": "1.0.0",
    "generated_at": "2026-05-11T00:00:00Z",
    "source": {
      "method": "analyze",
      "from_ecosystem": null,
      "repo_path": "/home/user/projects/space-explorer"
    }
  },

  "context": {
    "project_summary": "A 3D space exploration game built with Unity 6 using the Universal Render Pipeline (URP). Players fly a spaceship through procedurally generated star systems, collect resources, and upgrade their ship. Uses C# MonoBehaviour components, ScriptableObject data assets, and an event-driven architecture via ScriptableObject event channels.",
    "tech_stack": [
      { "name": "Unity", "version": "6.0", "role": "engine" },
      { "name": "C#", "version": ".NET 8 / IL2CPP", "role": "language" },
      { "name": "Universal Render Pipeline (URP)", "version": "17.x", "role": "render-pipeline" },
      { "name": "Unity Addressables", "version": "2.x", "role": "asset-management" },
      { "name": "Unity Input System", "version": "1.x", "role": "input" },
      { "name": "Unity Test Framework", "version": "1.x", "role": "test-runner" },
      { "name": "DOTween", "version": "^1.2", "role": "animation" }
    ],
    "directory_layout": {
      "Assets/Scripts/": "All C# game scripts",
      "Assets/Scripts/Core/": "Core game systems (GameManager, EventBus)",
      "Assets/Scripts/Player/": "Player ship components",
      "Assets/Scripts/World/": "Procedural generation and world systems",
      "Assets/Scripts/UI/": "UI components and controllers",
      "Assets/ScriptableObjects/": "SO data assets (ship configs, item definitions, event channels)",
      "Assets/Prefabs/": "Reusable prefab assets",
      "Assets/Scenes/": "Unity scene files",
      "Assets/Tests/": "Unity Test Framework test assemblies",
      "ProjectSettings/": "Unity project configuration"
    },
    "entry_points": [
      "Assets/Scripts/Core/GameManager.cs",
      "Assets/Scenes/MainMenu.unity",
      "Assets/Scenes/GameScene.unity"
    ],
    "build_commands": {
      "test": "Unity -runTests -testPlatform EditMode",
      "build": "Unity -buildTarget StandaloneWindows64 -executeMethod BuildScript.Build"
    },
    "environment_variables": [],
    "monorepo": null
  },

  "rules": [
    {
      "id": "monobehaviour-no-constructor",
      "scope": "file-glob",
      "scope_value": "Assets/Scripts/**/*.cs",
      "priority": 1,
      "category": "architecture",
      "content": "Never use C# constructors on MonoBehaviour classes. Use Awake() for self-initialization and Start() for cross-component references.",
      "rationale": "Unity controls MonoBehaviour instantiation. Constructors are called before Unity initializes the object.",
      "tags": ["unity", "monobehaviour"]
    },
    {
      "id": "cache-getcomponent",
      "scope": "file-glob",
      "scope_value": "Assets/Scripts/**/*.cs",
      "priority": 2,
      "category": "code-style",
      "content": "Cache GetComponent<>() calls in Awake(). Never call GetComponent<>() in Update(), FixedUpdate(), or LateUpdate().",
      "rationale": "GetComponent() is a slow lookup. Calling it every frame causes GC pressure and performance degradation.",
      "examples": {
        "good": "private Rigidbody _rb;\nvoid Awake() { _rb = GetComponent<Rigidbody>(); }",
        "bad": "void Update() { GetComponent<Rigidbody>().AddForce(Vector3.up); }"
      },
      "tags": ["unity", "performance"]
    },
    {
      "id": "no-alloc-in-update",
      "scope": "file-glob",
      "scope_value": "Assets/Scripts/**/*.cs",
      "priority": 2,
      "category": "code-style",
      "content": "Never allocate heap memory in Update(), FixedUpdate(), or LateUpdate(). No string concatenation, LINQ queries, or 'new' expressions in hot paths.",
      "rationale": "Heap allocations in the game loop cause garbage collection spikes and frame rate hitches.",
      "tags": ["unity", "performance", "gc"]
    },
    {
      "id": "serializedfield-not-public",
      "scope": "file-glob",
      "scope_value": "Assets/Scripts/**/*.cs",
      "priority": 3,
      "category": "code-style",
      "content": "Use [SerializeField] private instead of public fields for inspector-exposed values. Use public properties for read access.",
      "rationale": "Public fields expose implementation details and bypass encapsulation.",
      "examples": {
        "good": "[SerializeField] private float _speed = 5f;\npublic float Speed => _speed;",
        "bad": "public float speed = 5f;"
      },
      "tags": ["unity", "encapsulation"]
    },
    {
      "id": "scriptableobject-no-runtime-state",
      "scope": "file-glob",
      "scope_value": "Assets/ScriptableObjects/**/*.cs",
      "priority": 2,
      "category": "architecture",
      "content": "Do not store runtime-mutable session state in ScriptableObjects. They persist between Play Mode runs in the Unity Editor.",
      "rationale": "State stored in ScriptableObjects during Play Mode persists after stopping, causing hard-to-debug test pollution in the editor.",
      "tags": ["unity", "scriptableobject"]
    },
    {
      "id": "coroutine-store-reference",
      "scope": "file-glob",
      "scope_value": "Assets/Scripts/**/*.cs",
      "priority": 4,
      "category": "code-style",
      "content": "Store Coroutine return values when you might need to stop them: private Coroutine _myRoutine = StartCoroutine(MyRoutine());",
      "tags": ["unity", "coroutines"]
    },
    {
      "id": "compare-tag-not-string",
      "scope": "file-glob",
      "scope_value": "Assets/Scripts/**/*.cs",
      "priority": 3,
      "category": "code-style",
      "content": "Use gameObject.CompareTag() instead of gameObject.tag == \"Player\" string comparison.",
      "rationale": "CompareTag() avoids string allocation and is faster than == comparison.",
      "tags": ["unity", "performance"]
    },
    {
      "id": "domain-reload-static-reset",
      "scope": "global",
      "scope_value": null,
      "priority": 3,
      "category": "architecture",
      "content": "Since Domain Reload is disabled, static fields and events must be explicitly reset in [RuntimeInitializeOnLoadMethod(RuntimeInitializeLoadType.SubsystemRegistration)].",
      "rationale": "Without Domain Reload, static state persists between Play Mode runs. Failure to reset causes subtle test pollution.",
      "tags": ["unity", "domain-reload", "static"]
    },
    {
      "id": "addressable-release-handles",
      "scope": "global",
      "scope_value": null,
      "priority": 2,
      "category": "architecture",
      "content": "Always release AsyncOperationHandle references when done with Addressables. Store handles to release them in OnDestroy().",
      "rationale": "Unreleased handles cause memory leaks that accumulate over long play sessions.",
      "tags": ["unity", "addressables", "memory"]
    }
  ],

  "permissions": {
    "allow": [],
    "deny": [],
    "ask_on": []
  },

  "memory": {
    "always_load": [
      "Assets/Scripts/Core/GameManager.cs"
    ],
    "on_demand": [
      "Assets/ScriptableObjects/",
      "ProjectSettings/ProjectVersion.txt"
    ],
    "ignore": []
  },

  "hooks": [],

  "skills": [],

  "agents": [],

  "ignore_patterns": [
    "Library/",
    "Temp/",
    "obj/",
    "Logs/",
    "UserSettings/",
    "*.pidb",
    "*.suo",
    ".vs/",
    "*.sln",
    "*.userprefs"
  ],

  "extensions": {
    "aider": {
      "model": "claude-sonnet-4-5",
      "auto_commits": false
    }
  }
}
